"Speaker","Start time","End time","Duration (in sec)","Utterance"
"Speaker 1","0:00","0:03","2.5","Hi Chris, our Haiku Johnson's nice to meet."
"Speaker 2","0:03","0:04","1.0","You. Nice to meet you Kate. "
"Speaker 1","0:05","0:07","2.4000000000000004","Chris. Please tell me a little bit about yourself."
"Speaker 2","0:07","0:18","11.2","I'm currently finishing my masters of education program at Lake Erie College and working on transitioning from a northeastern Ohio inner to being a member of the Jacksonville area Community."
"Speaker 1","0:18","0:21","2.5","Why the move. "
"Speaker 2","0:21","0:25","4.300000000000001","Well, my wife's job is moving down south and I'm coming along with her. "
"Speaker 1","0:25","0:35","9.300000000000004","It's very Noble and my admirer beloved about you at the same time. How did you hear about the position open with our company here at REI? Well, when I thought."
"Speaker 2","0:35","1:10","35.099999999999994","About the opportunity of changing locations and moving from one physical location to another I thought about making a career move as well and I was starting with my main interests and passions and I love being outside. I love doing outdoor activities and I love working with people and I thought if I could use my experience as a teacher helping people and my interest in the outdoors together. It would be a good place to start a new career. And when I was looking online, I found re eyes website and that there were positions available in the Jacksonville area. So I thought I would apply great. "
"Speaker 1","1:10","1:20","9.900000000000006","Well, you say you have an interest in outdoor activities. So this would be a great company for you to work at that being said what else do you know about our company? "
"Speaker 2","1:20","1:48","27.599999999999994","Well, I know you've been around for a long time since the late 1930s and what really caught my attention the most was the idea that it was started by people who had a passion for the outdoors. And found a way to involve others in their experience. I like the idea too that your company is consistently ranked among the top 100 companies to work for by Fortune Magazine, and I thought growing with a company that has that level of success would be a good place to be great. "
"Speaker 1","1:51","1:56","5.6000000000000085","Why why do you want this particular position here with on within our customer service department? "
"Speaker 2","1:57","2:20","23.200000000000017","Because I want to start in a position that allows me to learn everything about the company from the very basic level of interacting with the customers all the way up throughout the sales process the marketing process and the production of goods and services when I saw the opportunity for customer service, I thought of the line very well with the skill set that I have and also with some skills that I could bring to the company that might be unique. "
"Speaker 1","2:20","2:26","5.599999999999994","You tell me a little bit more about these skills that you would transfer from your previous line of work to our department here. "
"Speaker 2","2:26","2:43","16.80000000000001","Sure in education. It's all about making the customer or student feel comfortable and helping them grow. I feel that within a company like REI. It's the same philosophy getting a customer comfortable with the product and helping them grow as they advance in whatever sport they happen to be participating in. "
"Speaker 1","2:45","2:52","7.0","Why do you think that our company should hire you specifically amongst our pool of Candidates that are interviewing for this position. "
"Speaker 2","2:53","3:22","29.19999999999999","Sure, I think one skill set that I have involves my background in education teachers are among the highest stressed Professionals in the workplace and REI offers a number of products that help alleviate stress by getting people outdoors and teachers also have a lot of downtime in the Summers. My thinking is that once I learn the ropes and Advance within the company, I'll be able to market the services and products that are I offers specifically to the teaching. Profession great. "
"Speaker 1","3:24","3:51","27.19999999999999","I have to ask this question given that you are making a career change here, especially with finishing a master's degree in education. If a position becomes available in your current field down here in the Jacksonville area. How do you approach being offered this job versus being offered a position in your field and I'm asking that in the now and Future. "
"Speaker 2","3:51","4:28","37.20000000000002","Sure. That's a great question. I'm not pursuing further educational opportunities within that profession. I feel like this customer service opportunity the chance to work in a field that I enjoy as much as teaching is a place that I could grow into long-term. So what I get out of teaching is working with people and helping people become a little bit better than they were when I first met them and that skill translates very well into our apis mission and so I Don't anticipate leaving a successful career for something. I've already done. I feel like this is a natural Confluence of my to interests. "
"Speaker 1","4:32","4:38","5.399999999999977","Chris. What would you identify as your greatest professional strengths? "
"Speaker 2","4:40","4:53","13.5","I think patients is probably my greatest strength that translates across the careers being able to listen to a student or customers difficulty and help them overcome that Quality with patience and compassion is my greatest strength. "
"Speaker 1","4:54","4:59","5.199999999999989","Would you consider any weaknesses that you have to be detrimental to the job? "
"Speaker 2","5:00","5:30","30.19999999999999","I think there's a risk when it comes to compassion. I think people can misinterpret compassion as being easy or willing to roll over when it's important to understand that compassion is something that is earned and it's interactive and I feel like if I establish clear boundaries He's with customers clients students. They understand that I am understanding. I am patient. I am kind yet. I'm also going to hold the people I interact with to a high standard. "
"Speaker 1","5:32","5:36","4.100000000000023","To date. What would you say is your greatest professional achievement? "
"Speaker 2","5:38","5:52","14.5","Personally becoming a teacher earning a master's degree. Those have all been wonderful experiences for me. But the greatest achievement would have to be working with young people and helping them get a little bit better at communicating with the world around them. "
"Speaker 1","5:57","6:04","6.899999999999977","Chris can you tell me about a challenge or conflict that you faced in the workplace and how you would deal with it? Sure. "
"Speaker 2","6:04","6:46","41.80000000000001","Within the education profession. There are challenges every day. You're dealing with hundreds of different hundreds of different personalities and interests and levels of enthusiasm. So being able to engage students with content and enriching way is part of overcoming a conflict or difficulty. I think building professional relationships is another way to deal with conflicts understanding where people come from Prior to teaching I was involved with a photography company photographing events, like weddings and bar mitzvahs and very very important events in people's lives and a lot of times conflicts that arise. So again, just like in teaching overcoming those conflicts with with patients and listening to the client or customers needs is very important. "
"Speaker 1","6:47","7:06","19.19999999999999","Now you are interviewing for a position that is not an entry level position and there is the possibility that those in our company that were overlooked for this position may have some animosity regarding the new hire for this position. So how do you approach this potential challenge here at the workplace? "
"Speaker 2","7:06","7:30","23.899999999999977","The important thing is to listen to the people around me and understand that I am a newcomer and that they know more about the work environment then I will coming in. I think because I have a friendly demeanor and I'm not confrontational when meeting new people that in time will have a chance to earn each other's mutual respect and understand that we both want the same thing the company to grow and us to grow within the company. "
"Speaker 1","7:32","7:36","4.0","Where do you see yourself in five years, specifically he within our company. "
"Speaker 2","7:36","7:46","9.799999999999955","Hopefully I'll be able to develop a market that allows me to interact with people within the teaching profession and and grow our brand using that market as a Target client base. It's great. "
"Speaker 1","7:51","7:57","6.5","Are you interviewing currently with any other companies and if so what interests you about those particular companies as well. "
"Speaker 2","7:58","8:16","18.30000000000001","Since I'm new to the area. I haven't had the opportunity to interview with a wide variety of companies. I have looked at Bass Pro Shops and I'm currently scheduled to interview with them. They have a similar Mission and similar goals to REI. It's just that their product line is more specifically tailored than re is more diverse offerings. "
"Speaker 1","8:19","8:45","26.099999999999966","We here at REI, you know, it is being in customer service. There are aspects of your job that are going to be a little less active than I could expect you being in a teaching position where I assume you're on your feet more one-on-one face-to-face with individuals. Do you prefer a specific type of work environment? Do you thrive in a variety of work environments? And what does this look like? "
"Speaker 2","8:46","9:15","29.100000000000023","Well, I thrive in Variety of work environments I wouldn't expect to be sitting in a cubicle interacting with customers unless I'm handling a phone call and that's fine. That's part of the job. But what I would expect is to be actively engaged with the customers who come into the store and helping show them the products that might best suit their needs and introducing them to products that they might not have considered before. So what I've expected to be up moving around and being consistently engaged with a customer or trying to find ways to improve what we offer to our customers. "
"Speaker 1","9:16","9:26","9.600000000000023","Can you describe a time for me ever that you may have disagreed on a decision that was made for you and staff members at work. And how did you deal with this? "
"Speaker 2","9:26","9:56","29.699999999999932","Sure within the field of Education. There are new initiatives being rolled out all the time. And sometimes those initiatives get mandated you have to teach this way this many times a week and when something like that happens, I think it's important to go back to what you know about your profession or your skill set and be able to provide research that supports why you do what you do. And I think when faced with a difficulty again, it's important to do what the boss says and it's an important to also advocate for what might be best for the customer or student. "
"Speaker 1","9:60","10:12","12.699999999999932","All right, we're going to move on to some cognitive behavioral questions. And basically these questions are designed. They're not necessarily about your past your experience. There are sort of out of the box."
"Speaker 2","10:12","10:13","1.1000000000000227","Questions. And."
"Speaker 1","10:13","10:21","7.7000000000000455","So just do your best at answering them as her go through this. So if you were an animal, what would you be and why? "
"Speaker 2","10:23","10:45","22.200000000000045","Tough question, I think. Considering the the traits of my dog if I had to be an animal I would certainly want to be a domesticated dog. They just have that ability to love unconditionally, they're intensely loyal and they just provide so many benefits to people something. I'd like to do in my life as a human to Great. "
"Speaker 1","10:47","10:51","4.600000000000023","The next question how many tennis balls can you fit into a limousine. "
"Speaker 2","10:53","11:32","39.10000000000002","Tennis balls in the limousine? I guess to effectively answer that question. I would need some help. I would need to know what type of limousine because if we're talking about a stretch SUV. That's a much larger volume than a smaller limousine. Are we talking to door for door? I also don't know what's in the limousine already other people in there or is it empty once I had those questions answered I'd have to do some calculations about the size of a tennis ball how much area or how much volume it takes up calculate the inside of the limousine and then And make sure the math works out I could get that answer to you. I just can't do it off the top of my head, right? "
"Speaker 1","11:36","11:40","4.100000000000023","Let me ask this final question are do you have any questions for us? "
"Speaker 2","11:41","11:55","14.399999999999977","Well, I mentioned a couple times about being interested in helping grow a market for REI. I'm just curious as a new employee or someone starting out on the lower level. How open is upper management hearing the ideas of an employee. "
"Speaker 1","11:56","12:49","52.200000000000045","We do try to have monthly meetings where we meet with a variety of employees at random. So these aren't things that are necessarily Scheduled regularly, they're very they're very semiannual. They're very informal. We do like to hear our employees opinions about our products, especially and about marketing. One thing that we don't necessarily do is the lower level positions that are dealing maybe with collections or you know, the intake and distribution of customer service calls. We don't necessarily talk to that group of employees. He's very often but I'd be very interested to hear your opinions on that. Should you be hired for the position and maybe ways that we could do better as well by reaching a larger group of our employees to benefit our company."
"Speaker 2","12:49","12:54","5.699999999999932","Okay. And then last question for me what from your perspective is the best part about working for REI? "
"Speaker 1","12:55","13:36","40.5","I think the work atmosphere with our company is very welcoming and even in my position and somewhat upper management those that I work for that are above me. They're very We're very good to our employees and I think because of the treatment of our employees we retain employment. It's very easy for us to get things done because people want to do their jobs. I have worked myself in positions where I worked underneath people who were more tyrannical in nature and it's very difficult to want to do more and go above and beyond what you need to do in those situations. So I believe that that's the number one benefit of working in our particular company is the atmosphere itself. "
"Speaker 2","13:36","13:38","2.5","Great. Thank you so much for your time K. I appreciate much. "
"Speaker 1","13:38","13:39","0.39999999999997726","Take care."
"Speaker 1","13:39","14:14","22.600000000000023","No your Senator Harris Tony for life to get back to normal. Dr. Anthony fauci and other experts say that most of the people who can be back stated need to be vaccinated but half of Americans now say they wouldn't take a vaccine if it was released now. If the Trump Administration approves a vaccine before or after the election should Americans take it and would you take."
"Speaker 2","14:14","14:28","13.200000000000045","It if the public health professionals if dr. fauci if the doctors tell us that we should take it. I'll be the first in line to take it. Absolutely. But if Donald Trump tells us I should say that we should take it. I'm not taking it. "
"Speaker 1","14:29","15:25","56.0","Vice president Pence there been a lot of repercussions from this pandemic in recent days. The president's diagnosis of covid-19 has underscored the importance of Job that you hold and that you were seeking that's our second topic tonight. It's the role of the vice president. One of you will make history on January 20th. We would be the vice president to the oldest president. The United States has ever had Donald Trump will be 74 years old on inauguration day. Joe Biden will be 78 years old that already has raised concerns among some voters concerns that have been sharpened by President Trump's hospitalization in recent days. Vice president Pence have you had a conversation or reached an agreement with President Trump about safeguards or procedures when it comes to the issue of presidential disability? And if not, do you think you should you have two minutes without interruption? "
"Speaker 3","15:25","17:30","125.30000000000007","Well, Susan thank you. Although I would like to go back to move on but I would like to go back because the reality is that we're going to have a vaccine senator in record time in on her. Heard of time in less than a year. We have five companies in Phase 3 clinical trials and we're right now producing tens of millions of doses. So the fact that you continue to undermine public confidence in a vaccine if the vaccine emerges during the Trump Administration I think is is unconscionable and Senator. I just asked you Stop playing politics with people's lives. The reality is that we will have a vaccine We Believe before the end of this year and it will have the capacity to say countless American lives and your continuous undermining of confidence in a vaccine is just it's just unacceptable and let me also say you know, the reality is when you talk about about failure in this Administration. We actually do know what failure looks like in a pandemic. It was 2009 the swine flu arrived in the United States. Thankfully it was ended up me not being as lethal as the coronavirus. But before the end of the year when Joe Biden was vice president of the United States not seven and a half million people contracted the swine flu 60 million Americans contract with the swine flu. If the swine flu had been as lethal as the coronavirus in 2009 when Joe Biden was vice president, we would have lost two million American lives his own Chief of Staff. Ron. Klain would say last year that it was pure luck that they did quote everything possible wrong and in we learned from that they left the Strategic National stockpile empty. They left an empty and Hollow plan, but we still learn from it and I think American people and I see again can."
"Speaker 1","17:30","17:32","1.2999999999999545","Be priced present tense. I'm sorry."
"Speaker 3","17:32","17:36","4.900000000000091","What we have done and Senator, please. Thank you very much for undermining confidence in a vaccine. "
"Speaker 1","17:37","17:58","21.300000000000182","Senator Harris. Let me ask you the same question that I asked vice president Pence which is have you had a conversation or reached an agreement with Vice President Biden about safeguards or procedures when it comes to the issue of presidential disability. And if not and if you win the election next month, do you think you should you have two minutes uninterrupted? "
"Speaker 2","17:58","20:03","124.79999999999995","Let me tell you first of all the day I got the call from from Joe Biden. It was actually Zoom call asking me to serve with him on this ticket was probably one of the most memorable memorable days of my life. I you know, I thought about my mother who came to the United States at the age of 19. I'm gave birth to me at the age of 25 at Kaiser Hospital in Oakland, California. And the thought that I'd be sitting here right now, I know would make her proud and she must be looking down on this, you know, Joe and I were raised in a very similar way. We were raised with values that are about hard work about the value and the Dignity of public service and about the importance of fighting for the Dignity of all people and I think Joe asked me to serve with him because You know, I have a career that included being elected the first woman district attorney of San Francisco where I created models of innovation for law enforcement in terms of Reform of the Criminal Justice System. I was elected the first woman of color and black woman to be elected Attorney General of the State of California where I ran the second largest Department of Justice in the United States second only to the United States Department of Justice and there I took on everything from transnational criminal organizations to The big banks that were taking advantage of homeowners to for-profit colleges that were taking advantage of veterans and then of course now I serve in the United States Senate is only the second black woman ever elected to the United States Senate I serve on the Senate intelligence committee where I've been in regular receipt of classified information about threats to our nation and hotspots around the world. I've traveled the world. I've met with our soldiers in are in war zones and I think Joe has asked me to serve with him because he knows that we share. We share a purpose which is about lifting up the American people and after the four years that we have seen of Donald Trump unifying our country around our common values and principles."
"Speaker 1","20:03","20:30","26.899999999999864","Thank you, Senator Harris. You do need that. Neither President Trump nor Vice President. Biden has released a sort of detailed health information that have become the modern Norm until the 2016 election and in recent days President Trump's doctors have given misleading answers or refuse to answer basic questions about his health and my question to each of you. In turn is is this information voters deserve to know vice president Pence. Would you like to go first? "
"Speaker 3","20:31","21:51","80.0","Well, I'm Susan. Thank you and let me let me say on behalf of the president and the first lady how move we've all been by the outpouring of prayers and concern and for the president and I do believe it's emblematic of the prayers and the concern that have ushered forth forever. American impacted by the coronavirus but the care of the president received at Walter Reed hospital White House doctors was exceptional and the transparency that they practiced all along the way we'll continue the American people have a right to know about the health and well-being of their president and will continue to do that. But I'm just extremely grateful and was more than more than a little moved by the broad and bipartisan support and sin. I want to thank you and Jill Biden for your Expressions genuine concern and I also want to congratulate you as I did on that phone call on the historic nature of your nomination. I never expected to be on the stage four years ago. So I know the feeling but the reality is we've got an election before the American people in the midst of this challenge a year and the stakes have never been higher. Basically the choice has."
"Speaker 1","21:51","22:06","14.599999999999909","Never been as they want to. Senator Harris a chance to respond to the same question I asked which is do voters have a right to know more detailed health information about presidential candidates and especially about presidents especially when they're facing some kind of challenge."
"Speaker 2","22:06","23:27","81.70000000000005","Absolutely and that's why Joe Biden has been so incredibly transparent and certainly by contrast. The president has not both in terms of health records, but also, let's look at taxes. We now know because of great investigative journalism that Not paid 750 dollars in taxes when I first heard about it. I literally said you mean 750,000 dollars and it was like no 750 dollars. We now know Donald Trump owes and is in debt for 400 million dollars in just so everyone is clear when we say in debt. It means you owe money to somebody. And it'd be really good to know who the president of the United States the commander-in-chief owes money to because the American people have a right to know what is influencing the president's decisions. And is he making those decisions on the best interest of the American people of you or self-interest? So Susan I'm glad you asked about transparency because it has to be across the board. Joe has been incredibly transparent over many many years. The one thing we all know about. Joe he puts it all out there. He he is honest he is forthright. But Donald Trump on the other hand has been about covering up everything. Thanks."
"Speaker 1","23:27","23:30","3.0","Thank you, Senator Harris. I want to give you a chance to respond vice president."
"Speaker 3","23:30","24:28","57.59999999999991","Will look I respect the fact that Joe Biden spent 47 years in public life. I respect your Public Service as well. Thank you. The American people have a president was businessman. It's a job creator. Who's paid tens of millions of dollars in taxes payroll taxes property taxes? He's created tens of thousands of American jobs. The president said those public reports are not accurate and the president's also released literally stacks of financial disclosures. The American people can review just as the law allows. But the distinction here is that Joe Biden 47 years in public service compared to President Donald Trump who brought All of that experience four years ago. Thank you very much. Thank you for trying to this economy around by cutting taxes rolling back regulations. Thank you. Thank you guys for energy fighting for free and fair trade and all of us a nice present. If Joe Biden and Kamala Harris, you."
"Speaker 1","24:28","24:30","2.2000000000000455","Know, that's a good segue into our third."
"Speaker 2","24:30","24:31","1.099999999999909","Topic which is."
